{
  "schema": "review-verdict-v1",
  "run_id": "rv-20260803-001",
  "pr_number": 186,
  "subject_head_sha": "abc1234def5678",
  "risk_class": "LOW",
  "timestamp": "2026-08-03T00:00:00Z",
  "tasks": {
    "tier0": "pass",
    "review-analysis": "not_run",
    "adversarial-execution": "not_run",
    "tier2": "not_run"
  },
  "findings": [],
  "verdict": "PARTIAL"
}
